{
  "idea_title": "Mechanism-indexed evaluation protocol for multi-step decision pipelines",
  "scores": {
    "novelty": 75,
    "feasibility": 66,
    "impact": 81
  },
  "objections": [
    {
      "reviewer": "R1",
      "severity": "high",
      "text": "Baseline selection does not yet cover strongest recent evaluation protocols."
    },
    {
      "reviewer": "R2",
      "severity": "medium",
      "text": "Need clearer mapping from probe outcomes to final thesis claims."
    }
  ],
  "revision_suggestions": [
    "Add stronger baseline protocols from adjacent subfields",
    "Explicitly map each metric to claim-level evidence"
  ]
}
